{
  "schema_version": 1,
  "event_id": "019a9f34-8ac0-7a00-a101-123456789abc",
  "run_id": "019a9f34-8ac0-7a00-a102-123456789abc",
  "workflow_id": "019a9f34-8ac0-7a00-a103-123456789abc",
  "event_type": "run.completed",
  "occurred_at": "2026-10-11T05:10:00Z",
  "job_key": "repository-daily-stats",
  "repository_key": "repo-a",
  "operation": "stats",
  "client": {
    "name": "restic-monitor-bash",
    "version": "0.1.0",
    "restic_version": "0.19.1"
  },
  "result": {
    "exit_code": 0,
    "started_at": "2026-10-11T05:09:58Z",
    "finished_at": "2026-10-11T05:10:00Z",
    "duration_ms": 2000,
    "repository_stats": {
      "mode": "restore-size",
      "value_bytes": 8192,
      "total_file_count": 4,
      "total_blob_count": 8,
      "snapshots_count": 2,
      "total_uncompressed_size": 16384
    }
  }
}
